prop_id,casa,data_hora,sequencia,texto_tramitacao,sigla_local,id_situacao,descricao_situacao,link_inteiro_teor,id_principal
2199500,camara,2019-04-25T15:45:00Z,1,"Apresentação do Requerimento n. 37/2019, pelo Deputado Henrique Fontana (PT-RS), que: ""Requer  a realização de audiência pública para debater, nesta Comissão, 'os impactos sócios da PEC nº 06/2019' - Reforma da Previdência, com a presença dos seguintes convidados: Laura Tavares Ribeiro Soares - Doutorado em Economia com Área de Concentração em Política Social pelo Instituto de Economia da Universidade Estadual de Campinas - UNICAMP;  Luciana de Barros Jaccoud - Doutora em Sociologia pela École des Hautes Études en Sciences Sociales, França, colaboradora da Escola Nacional de Administração Pública (ENAP) e pesquisadora associada ao Grupo de Pobreza e Políticas Sociais da Clacso; Luiz Alberto dos Santos -Sociedade Brasileira de Previdência Social-SBPC; Instituto Brasileiro de Direito Previdenciário - IBDP"".",PEC00619,100,Aguardando Providências Internas,http://www.camara.gov.br/proposicoesWeb/prop_mostrarintegra?codteor=1737832,2199500
2199500,camara,2019-05-07T14:30:00Z,2,Aprovado,PEC00619,241,Aguardando Providências Internas,NA,2199500
2199500,camara,2019-05-14T00:00:00Z,3,"Audiência Pública realizada com a presença dos seguintes convidados:Tema: Regime Próprio de Previdência Social (RPPS) da União, dos Estados e dos Municípios.Convidados:LUCIANO FAZIO, Consultor e Especialista em Previdência Social do Departamento Intersindical de Estatística e Estudos Socioeconômicos - DIEESE (confirmado);LUIZ ALBERTO DOS SANTOS, Vice-Presidente da Sociedade Brasileira de Previdência Social - SBPS (confirmado);MARIONALDO FERNANDES MACIEL, Presidente do Instituto de Previdência Social do Município de Campinas, representando a FNP - Frente Nacional de Prefeitos (confirmado); eNARLON GUTIERRE NOGUEIRA, Secretário Adjunto de Previdência no Ministério da Economia (confirmado).Em atendimento aos Requerimentos:REQ 27/19 - Alice PortugalREQ 37/19 - Henrique FontanaREQ 42/19 - Gleisi HoffmannREQ 50/19 - Marco Bertaiolli (aditado por Jeronimo Goergen, José Guimarães e Beto Pereira)REQ 51/19 - Alan Rick (aditado por Darcísio Perondi)REQ 67/19 - Jorge SollaREQ 112/19 - Sâmia Bomfim e Ivan Valente.",PEC00619,1005,Aguardando Providências Internas,NA,2199500
2199500,camara,2019-05-21T00:00:00Z,4,"Audiência publica realizada com a presença dos seguintes convidados:Tema: Benefício de Prestação Continuada e Abono SalarialARTHUR BRAGANÇA DE VASCONCELLOS WEINTRAUB - Assessor Especial da Presidência da República;LEONARDO ALVES RANGEL - Diretor de Programa na Secretaria Especial de Previdência e Trabalho no Ministério da Economia;LUCIANA DE BARROS JACCOUD - Pesquisadora no Instituto de Pesquisa Econômica Aplicada - IPEA; ePEDRO ROSSI - Professor do Instituto de Economia da Universidade de Campinas - UNICAMP.Requerimentos atendidos:REQ 1/19 - Diego Garcia e Vinicius PoitREQ 7/19 - André Figueiredo, Fábio Henrique, Mauro Benevides Filho e Paulo RamosREQ 11/19 - Pastor EuricoREQ 15/19 - Dr. FredericoREQ 17/19 - Léo MoraesREQ 34/19 - Alice PortugalREQ 37/19 - Henrique FontanaREQ 61/19 - Silvio Costa FilhoREQ 65/19 - Jorge SollaREQ 118/19 - Sâmia Bomfim e Ivan Valente",PEC00619,1005,Aguardando Providências Internas,NA,2199500
2199500,camara,2019-05-22T00:00:00Z,5,"Audiência realizada com a presença dos seguintes convidados:Tema: ""Aposentadoria do Trabalhador Rural""ARISTIDES VERAS DOS SANTOS - Presidente da Confederação Nacional dos Trabalhadores na Agricultura - CONTAG;BRUNO BIANCO LEAL - Secretário Especial Adjunto de Previdência e Trabalho no Ministério da Economia;JANE LÚCIA WIHEIM BERWANGER - Presidente do Instituto Brasileiro de Direito Previdenciário - IBDP; eMARINA BRITO BATTILANI - Presidente da FUNDACENTRO - Fundação Jorge Duprat Figueiredo, de Segurança e Medicina do Trabalho.Requerimentos atendidos:REQ 3/19 - Diego GarciaREQ 4/19 - Diego GarciaREQ 6/19 - Adriana VenturaREQ 11/19 - Pastor EuricoREQ 21/19 - Alice PortugalREQ 32/19 - Alice PortugalREQ 37/19 - Henrique FontanaREQ 40/19 - Gleisi HoffmannREQ 47/19 - Perpétua AlmeidaREQ 61/19 - Silvio Costa Filho REQ 62/19 - Jorge SollaREQ 66/19 - Jorge SollaREQ 73/19 - Pedro UczaiREQ 88/19 - Carlos VerasREQ 107/19 - Luiza Erundina, Sâmia Bomfim e Ivan Valente",PEC00619,1005,Aguardando Providências Internas,NA,2199500
