prop_id,casa,data_hora,sequencia,texto_tramitacao,sigla_local,id_situacao,descricao_situacao,link_inteiro_teor,id_principal
2199922,camara,2019-05-06T15:35:00Z,1,"Apresentação do Requerimento n. 61/2019, pelo Deputado Silvio Costa Filho (PRB-PE), que: ""Solicita o convite para participar de audiência pública a equipe responsável pela elaboração da proposição: Senhor Paulo Guedes, Excelentíssimo Ministro da Economia; Senhor Rogério Marinho, Secretário Especial de Previdência e Trabalho; Senhor Bruno Bianco Leal, Secretário Especial Adjunto de Previdência e Trabalho; e Senhor Leonardo Rolim, Secretário de Previdência"".",PEC00619,100,Aguardando Providências Internas,http://www.camara.gov.br/proposicoesWeb/prop_mostrarintegra?codteor=1741090,2199922
2199922,camara,2019-05-07T14:30:00Z,2,Aprovado,PEC00619,241,Aguardando Providências Internas,NA,2199922
2199922,camara,2019-05-08T00:00:00Z,3,"Audiência Pública realizada com a presença dos seguintes convidados:Tema: Apresentação Geral da PEC 6/2019PAULO ROBERTO NUNES GUEDES - Ministro da Economia;ROGÉRIO MARINHO - Secretário Especial de Previdência e Trabalho;BRUNO BIANCO LEAL - Secretário Especial Adjunto de Previdência e Trabalho;LEONARDO JOSÉ ROLIM GUIMARÃES - Secretário de Previdência.(Em atendimento aos Requerimentos:1/19, dos Deps. Diego Garcia e Vinícius Poit;3/19 e 4/19, do Dep. Diego Garcia;7/19, dos Deps. André Figueiredo, Fábio Henrique, Mauro Benevides Filho e Paulo Ramos;8/19, dos Deps. André Figueiredo, Fábio Henrique, Mauro Benevides Filho e Paulo Ramos;11/19, do Dep. Pastor Eurico;12/19, da Dep. Alice Portugal;13/19, do Dep. Dr. Frederico;17/19, do Dep. Léo Moraes;20/19, 21/19, 22/19, 27/19, 33/19 e 34/19, da Dep. Alice Portugal;52/19, do Dep. Professor Israel Batista;54/19, do Dep. Capitão Alberto Neto;55/19, do Dep. Eduardo Cury;61/19, do Dep. Silvio Costa Filho;67/19, do Dep. Jorge Solla).",PEC00619,1005,Aguardando Providências Internas,NA,2199922
2199922,camara,2019-05-21T00:00:00Z,4,"Audiência publica realizada com a presença dos seguintes convidados:Tema: Benefício de Prestação Continuada e Abono SalarialARTHUR BRAGANÇA DE VASCONCELLOS WEINTRAUB - Assessor Especial da Presidência da República;LEONARDO ALVES RANGEL - Diretor de Programa na Secretaria Especial de Previdência e Trabalho no Ministério da Economia;LUCIANA DE BARROS JACCOUD - Pesquisadora no Instituto de Pesquisa Econômica Aplicada - IPEA; ePEDRO ROSSI - Professor do Instituto de Economia da Universidade de Campinas - UNICAMP.Requerimentos atendidos:REQ 1/19 - Diego Garcia e Vinicius PoitREQ 7/19 - André Figueiredo, Fábio Henrique, Mauro Benevides Filho e Paulo RamosREQ 11/19 - Pastor EuricoREQ 15/19 - Dr. FredericoREQ 17/19 - Léo MoraesREQ 34/19 - Alice PortugalREQ 37/19 - Henrique FontanaREQ 61/19 - Silvio Costa FilhoREQ 65/19 - Jorge SollaREQ 118/19 - Sâmia Bomfim e Ivan Valente",PEC00619,1005,Aguardando Providências Internas,NA,2199922
2199922,camara,2019-05-22T00:00:00Z,5,"Audiência realizada com a presença dos seguintes convidados:Tema: ""Aposentadoria do Trabalhador Rural""ARISTIDES VERAS DOS SANTOS - Presidente da Confederação Nacional dos Trabalhadores na Agricultura - CONTAG;BRUNO BIANCO LEAL - Secretário Especial Adjunto de Previdência e Trabalho no Ministério da Economia;JANE LÚCIA WIHEIM BERWANGER - Presidente do Instituto Brasileiro de Direito Previdenciário - IBDP; eMARINA BRITO BATTILANI - Presidente da FUNDACENTRO - Fundação Jorge Duprat Figueiredo, de Segurança e Medicina do Trabalho.Requerimentos atendidos:REQ 3/19 - Diego GarciaREQ 4/19 - Diego GarciaREQ 6/19 - Adriana VenturaREQ 11/19 - Pastor EuricoREQ 21/19 - Alice PortugalREQ 32/19 - Alice PortugalREQ 37/19 - Henrique FontanaREQ 40/19 - Gleisi HoffmannREQ 47/19 - Perpétua AlmeidaREQ 61/19 - Silvio Costa Filho REQ 62/19 - Jorge SollaREQ 66/19 - Jorge SollaREQ 73/19 - Pedro UczaiREQ 88/19 - Carlos VerasREQ 107/19 - Luiza Erundina, Sâmia Bomfim e Ivan Valente",PEC00619,1005,Aguardando Providências Internas,NA,2199922
2199922,camara,2019-05-29T00:00:00Z,6,"Audiência Pública realizada com a presença dos seguintes convidados:Tema: Regime de Capitalização e Avaliação AtuarialFABIO ZAMBITTE - Professor Titular do Instituto Brasileiro de Mercado de Capitais - IIBMEC e Professor Adjunto da Universidade do Estado do Rio de Janeiro - UERJ;GUILHERME SANTOS MELLO - Professor do Instituto de Economia da UNICAMP;HÉLIO ZYLBERSTAJN - Professor de Economia na USP e pesquisador na FIPE/USP;LEONARDO JOSÉ ROLIM GUIMARÃES - Secretário de Previdência no Ministério da Economia;SÉRGIO GUIMARÃES FERREIRA - Departamento de Pesquisa Econômica no Banco Nacional de Desenvolvimento Econômico e Social - BNDES.Requerimentos atendidos:REQ 1/19 - Diego Garcia e Vinicius Poit, aditado por Jerônimo GoergenREQ 11/19 - Pastor Eurico, subscrito por Jorge SollaREQ 17/19 - Léo MoraesREQ 35/19 - Henrique Fontana, subscrito por Paulo TeixeiraREQ 61/19 - Silvio Costa FilhoREQ 67/19 - Jorge SollaREQ 121/19 - Sâmia Bomfim, Ivan Valente e Luiza ErundinaREQ 157/19 - Aliel Machado e Alessandro MolonREQ 160/19 - Marcelo Ramos",PEC00619,1005,Aguardando Providências Internas,NA,2199922
2199922,camara,2019-05-30T00:00:00Z,7,"Audiência pública realizada com a presença dos seguintes convidados:Tema: Transição e DesconstitucionalizaçãoBRUNO BIANCO LEAL - Secretário Especial Adjunto de Previdência e Trabalho no Ministério da Economia;FELIPE MÊMOLO PORTELA - Diretor de Programa na Secretaria Especial de Previdência e Trabalho no Ministério da Economia;FLORIANO MARTINS DE SÁ NETO - Presidente da Associação Nacional dos Auditores Fiscais da Receita Federal do Brasil - ANFIP;RUDINEI MARQUES - Presidente do Fórum Nacional Permanente das Carreiras Típicas de Estado - FONACATE.Requerimentos atendidos:REQ 3/19 - Diego Garcia, subscrito por Jorge SollaREQ 4/19 - Diego GarciaREQ 11/19 - Pastor Eurico, subscrito por Jorge SollaREQ 12/19 - Alice PortugalREQ 38/19 - Professor Israel BatistaREQ 51/19 - Alan RickREQ 54/19 - Capitão Alberto NetoREQ 61/19 - Silvio Costa FilhoREQ 76/19 - Pedro UczaiREQ 114/19 - Ivan Valente",PEC00619,1005,Aguardando Providências Internas,NA,2199922
