prop_id,casa,data_hora,sequencia,texto_tramitacao,sigla_local,id_situacao,descricao_situacao,link_inteiro_teor,id_principal
2200007,camara,2019-05-06T17:59:00Z,1,"Apresentação do Requerimento n. 97/2019, pelos Deputados Jorge Solla (PT-BA) e outros, que: ""Requer ao Ministério da Economia, informações para identificar, em detalhes, a elaboração do fluxo de caixa prospectivo do RGPS para os próximos 10 anos"".",PEC00619,100,Arquivada,http://www.camara.gov.br/proposicoesWeb/prop_mostrarintegra?codteor=1741293,2200007
2200007,camara,2019-05-07T14:30:00Z,2,Aprovado,PEC00619,241,Arquivada,NA,2200007
2200007,camara,2019-05-09T00:00:00Z,3,Apresentado o Requerimento de Informação nº 557/2019 à Mesa da Câmara dos Deputados.,PEC00619,1005,Arquivada,NA,2200007
2200007,camara,2019-07-02T00:00:00Z,4,"Recebimento de resposta conforme Ofício nº 317/2019/GME-ME, de 01 de julho de 2019, do Ministério da Economia.",PEC00619,1005,Arquivada,http://www.camara.gov.br/proposicoesWeb/prop_mostrarintegra?codteor=1782395,2200007
2200007,camara,2019-07-02T00:00:00Z,5,Arquivada,PEC00619,502,Arquivada,NA,2200007
