prop_id,casa,data_hora,sequencia,texto_tramitacao,sigla_local,id_situacao,descricao_situacao,link_inteiro_teor,id_principal
458855,camara,2009-11-10T00:00:00Z,1,"Apresentação do REQ 5840/2009, pelo Dep. Geraldo Pudim, que ""solicita a tramitação conjunta das Propostas de Emenda à Constituição n.º 215/2000 e 161/2007, com seus respectivos apensados.""",PLEN,100,NA,http://www.camara.gov.br/proposicoesWeb/prop_mostrarintegra?codteor=712148,458855
458855,camara,2009-11-10T20:22:00Z,2,Recebimento pela SEPRO -  - Patricia Silva Soares.,SEPRO,500,NA,NA,458855
458855,camara,2009-11-11T09:04:00Z,3,Encaminhado à(ao) NAJUR(SGM) através da guia de Remessa (GR/SEPRO) nº 4172/2009.,SEPRO,180,NA,NA,458855
458855,camara,2009-11-17T00:00:00Z,4,Despacho a Confirmar.,MESA,110,Tramitação do Requerimento Finalizada,http://www.camara.gov.br/proposicoesWeb/prop_mostrarintegra?codteor=714585,458855
458855,camara,2009-11-17T00:00:00Z,8,"DEFIRO, nos termos do art. 142 do RICD. Com efeito, promova-se a apensação da PEC n. 161/2007 à PEC n. 215/2000. Oficie-se. Publique-se.DCD18/11/09 PAG 64565 COL 01.",MESA,110,Tramitação do Requerimento Finalizada,http://www.camara.gov.br/proposicoesWeb/prop_mostrarintegra?codteor=714585,458855
458855,camara,2009-11-17T11:41:00Z,7,Notificação à Sinopse de Despacho Chancelado,SECAD(SGM),1005,NA,NA,458855
458855,camara,2009-11-17T11:41:00Z,5,Despacho Chancelado,SGMGAB,180,NA,NA,458855
458855,camara,2009-11-17T11:41:00Z,6,Encaminhamento de Chancela de Requerimento de Informações à SEPUB(SGM) para publicação.,MESA,604,Tramitação do Requerimento Finalizada,NA,458855
458855,camara,2009-11-17T11:41:00Z,9,Encaminhamento de Despacho de Distribuição à CCP para publicação.,MESA,604,Tramitação do Requerimento Finalizada,NA,458855
