prop_id,casa,data_hora,sequencia,texto_tramitacao,sigla_local,id_situacao,descricao_situacao,link_inteiro_teor,id_principal
523821,camara,2011-10-18T00:00:00Z,3,Publicação inicial no DCD do dia 19/10/2011,SEPUB(SGM),604,NA,NA,523821
523821,camara,2011-10-18T16:50:00Z,1,"Apresentação do Requerimento de Inclusão na Ordem do Dia n. 3489/2011, pelo Deputado Junji Abe (PSD-SP), que: ""Requer a inclusão de Proposta de Emenda à Constituição (PEC) nº. 215/2000 na pauta da Ordem do Dia"".",PLEN,100,NA,http://www.camara.gov.br/proposicoesWeb/prop_mostrarintegra?codteor=1027775,523821
523821,camara,2011-10-18T18:05:00Z,2,Recebimento pela SEPRO.,SEPRO,500,NA,NA,523821
523821,camara,2011-10-19T09:10:00Z,4,Encaminhado à(ao) SECOD(SGM) através da guia de Remessa (GR/SEPRO) nº 1346/2011.,SEPRO,180,NA,NA,523821
523821,camara,2012-09-26T00:00:00Z,5,Original encaminhado à CCP (DECOM),PLEN,1005,NA,NA,523821
