prop_id,casa,data_hora,sequencia,texto_tramitacao,sigla_local,id_situacao,descricao_situacao,link_inteiro_teor,id_principal
2121656,camara,2016-12-15T16:54:00Z,1,"Apresentação do Requerimento n. 7/2016, pela Deputada Professora Dorinha Seabra Rezende (DEM-TO), que: ""'Requer a realização  de Audiência Pública da Comissão  Especial para debater a PEC nº 15 de 2015 com os seguintes convidados: Daniel Cara - Coordenador da Campanha Nacional pelo Direito à Educação; Nelson Cardos Amaral - Professor, Faculdade de Educação da UFG;  Luiz Araújo - Professor da Faculdade de Educação da UnB; Carlos Roberto Jamil Cury - Professor da PUC/MG; Mozart Neves Ramos - Instituto Ayrton Senna'"".",PEC01515,100,Arquivada,http://www.camara.gov.br/proposicoesWeb/prop_mostrarintegra?codteor=1518305,2121656
2121656,camara,2017-02-21T14:30:00Z,2,Aprovado.,PEC01515,241,Arquivada,NA,2121656
2121656,camara,2017-02-21T14:30:00Z,3,Subscrito pela Dep. Raquel Muniz.,PEC01515,241,Arquivada,NA,2121656
2121656,camara,2017-03-07T00:00:00Z,4,"Audiência Pública realizada com o conviado Luiz Araújo, Professor da Faculdade de Educação da UnB.",PEC01515,1005,Arquivada,NA,2121656
2121656,camara,2017-04-18T00:00:00Z,5,Audiência Pública realizada com os seguintes convidados: Daniel Cara - Coordenador da Campanha Nacional pelo Direito à Educação; Nelson Cardoso Amaral - Professor da Faculdade de Educação da UFG.,PEC01515,1005,Arquivada,NA,2121656
2121656,camara,2018-04-24T00:00:00Z,6,Audiência Pública realizada com o convidado Daniel Cara - Coordenador da Campanha Nacional pelo Direito à Educação.,PEC01515,1005,Arquivada,NA,2121656
2121656,camara,2018-05-08T00:00:00Z,7,Audiência Pública realizada com o convidado Nelson Cardoso Amaral - Professor e Coordenador de Assuntos Institucionais da Reitoria da UFG.,PEC01515,1005,Arquivada,NA,2121656
2121656,camara,2019-01-31T00:00:00Z,8,Arquivado em decorrência do encerramento da Comissão Especial pelo fim da Legislatura.,PEC01515,502,Arquivada,NA,2121656
