prop_id,casa,data_hora,sequencia,texto_tramitacao,sigla_local,id_situacao,descricao_situacao,link_inteiro_teor,id_principal
2121655,camara,2016-12-15T16:54:00Z,1,"Apresentação do Requerimento n. 6/2016, pela Deputada Professora Dorinha Seabra Rezende (DEM-TO), que: ""'Requer a realização  de Audiência Pública da Comissão  Especial para debater a PEC nº 15 de 2015 com os seguintes convidados: José Roberto Afonso - economista; Amir Khair - economista (ou Márcio Pochmann); Eduardo Gianetti da Fonseca - economista; Reynaldo Fernandes - economista; Associação Nacional de Pesquisa em Financiamento da Educação (FINEDUCA); Conselho Nacional de Política Fazendária (CONFAZ).'"".",PEC01515,100,Arquivada,http://www.camara.gov.br/proposicoesWeb/prop_mostrarintegra?codteor=1518304,2121655
2121655,camara,2017-02-21T14:30:00Z,2,Aprovado.,PEC01515,241,Arquivada,NA,2121655
2121655,camara,2017-02-21T14:30:00Z,3,Subscrito pela Dep. Raquel Muniz.,PEC01515,241,Arquivada,NA,2121655
2121655,camara,2017-05-11T00:00:00Z,4,Audiência Pública realizada com o convidado Reynaldo Fernandes - Economista e Professor da Faculdade de Economia Administração e Contabilidade de Ribeirão Preto.,PEC01515,1005,Arquivada,NA,2121655
2121655,camara,2017-06-13T00:00:00Z,5,Audiência Pública realizada com o convidado José Roberto Rodrigues Afonso - Professor do mestrado do IDP (Instituto de Direito Público).,PEC01515,1005,Arquivada,NA,2121655
2121655,camara,2017-06-20T00:00:00Z,6,"Audiência Pública realizada com a convidada Lisete Regina Gomes Alelaro, Presidente FINEDUCA.",PEC01515,1005,Arquivada,NA,2121655
2121655,camara,2018-04-24T00:00:00Z,7,Audiência Pública realizada com o convidado Rubens Barbosa de Camargo - Presidente da Associação Nacional de Pesquisa em Financiamento da Educação (FINEDUCA).,PEC01515,1005,Arquivada,NA,2121655
2121655,camara,2019-01-31T00:00:00Z,8,Arquivado em decorrência do encerramento da Comissão Especial pelo fim da Legislatura.,PEC01515,502,Arquivada,NA,2121655
