prop_id,casa,data_hora,sequencia,texto_tramitacao,sigla_local,id_situacao,descricao_situacao,link_inteiro_teor,id_principal
2121650,camara,2016-12-15T16:54:00Z,1,"Apresentação do Requerimento n. 3/2016, pela Deputada Professora Dorinha Seabra Rezende (DEM-TO), que: ""Requer a realização  de Audiência Pública da Comissão  Especial para debater a PEC nº 15 de 2015 com os seguintes convidados: Ministério da Educação (MEC); Frente Nacional de Prefeitos (FNP); Confederação Nacional de Municípios (CNM); Observatório de Informações Municipais; Fórum Nacional de Secretários estaduais de Planejamento'"".",PEC01515,100,Arquivada,http://www.camara.gov.br/proposicoesWeb/prop_mostrarintegra?codteor=1518299,2121650
2121650,camara,2017-02-21T14:30:00Z,2,Aprovado.,PEC01515,241,Arquivada,NA,2121650
2121650,camara,2017-02-21T14:30:00Z,3,Subscrito pela Dep. Raquel Muniz.,PEC01515,241,Arquivada,NA,2121650
2121650,camara,2017-08-08T00:00:00Z,4,Audiência Pública realizada com os seguintes convidados: Elias Diniz - Vice-Presidente de Educação da Frente Nacional de Prefeitos - FNP e Francois Eugene Jean de Bremaeker - Gestor do Observatório de Informações Municipais.,PEC01515,1005,Arquivada,NA,2121650
2121650,camara,2017-09-12T00:00:00Z,5,Audiência Pública realizada com a convidada Marisa Abreu - Representante da Confederação Nacional de Municípios (CNM).,PEC01515,1005,Arquivada,NA,2121650
2121650,camara,2018-05-15T00:00:00Z,6,Audiência Pública realizada com o convidado Elias Diniz - Prefeito de Pará de Minas/MG e Representante da Frente Nacional de Prefeitos (FNP).,PEC01515,1005,Arquivada,NA,2121650
2121650,camara,2018-05-22T00:00:00Z,7,Audiência Pública realizada com o convidado Márcio Bastos Medeiros - Representante do Conselho Nacional de Secretários Estaduais de Planejamento - CONSEPLAN.,PEC01515,1005,Arquivada,NA,2121650
2121650,camara,2018-05-29T00:00:00Z,8,Audiência Pública realizada com a convidada Marisa Abreu - Representante da Confederação Nacional de Municípios (CNM).,PEC01515,1005,Arquivada,NA,2121650
2121650,camara,2019-01-31T00:00:00Z,9,Arquivado em decorrência do encerramento da Comissão Especial pelo fim da Legislatura.,PEC01515,502,Arquivada,NA,2121650
