prop_id,casa,data_hora,sequencia,texto_tramitacao,sigla_local,id_situacao,descricao_situacao,link_inteiro_teor,id_principal
2124541,camara,2017-03-07T10:27:00Z,1,"Apresentação do Requerimento de Audiência Pública n. 13/2017, pela Deputada Raquel Muniz (PSD-MG), que: ""Solicita realização de Audiência Pública para debater sobre a importância da perenidade do FUNDEB, notadamente para os Municípios. Convidados:1.Senhora Sueli Nobre, Ex. Secretária Municipal de Educação de Montes Claros - MG; e 2.Senhora Ana Angélica Gonçalves Paiva, professora, Especialista e Mestre em Educação."".",PEC01515,100,Arquivada,http://www.camara.gov.br/proposicoesWeb/prop_mostrarintegra?codteor=1528750,2124541
2124541,camara,2017-03-14T14:30:00Z,2,Aprovado com alterações para incluir as seguintes pessoas:1) Professor João Batista dos Mares Guia (sociólogo e consultor educacional).2) Jonatas Gonçalves Rêgo (Secretário Municipal de Educação de Mirabela - Minas Gerais).,PEC01515,241,Arquivada,NA,2124541
2124541,camara,2017-04-27T00:00:00Z,3,"Audiência Pública realizada com os seguintes convidados: Sueli Nobre, Ex-Secretária Municipal de Educação de Montes Claros - MG; Ana Angélica Gonçalves Paiva - Professora, Especialista e Mestre em Educação e Jonatas Gonçalves Rêgo - Secretário Municipal de Educação de Mirabela - MG.",PEC01515,1005,Arquivada,NA,2124541
2124541,camara,2017-09-05T00:00:00Z,4,"Audiência Pública realizada com o convidado João Batista dos Mares Guia - Professor, Sociólogo e Consultor Educacional.",PEC01515,1005,Arquivada,NA,2124541
2124541,camara,2018-03-01T00:00:00Z,5,Arquivado por ter sido atendido o objetivo do Requerimento.,PEC01515,502,Arquivada,NA,2124541
