prop_id,casa,data_hora,sequencia,texto_tramitacao,sigla_local,id_situacao,descricao_situacao,link_inteiro_teor,id_principal
2126073,camara,2017-03-20T14:09:00Z,1,"Apresentação do Requerimento de Audiência Pública n. 16/2017, pelo Deputado Thiago Peixoto (PSD-GO), que: ""Requer a realização de Audiência Pública desta Comissão Especial com a Presença do Secretário de Educação Básica do Ministério da Educação, o Senhor Rossieli Soares da Silva"".",PEC01515,100,Arquivada,http://www.camara.gov.br/proposicoesWeb/prop_mostrarintegra?codteor=1535628,2126073
2126073,camara,2017-03-28T14:30:00Z,2,Não Deliberado.,PEC01515,1008,Arquivada,NA,2126073
2126073,camara,2017-04-04T14:30:00Z,3,"Subscrito pelos deputados Raquel Muniz, Creuza Pereira e Professora Dorinha.Aprovado",PEC01515,241,Arquivada,NA,2126073
2126073,camara,2017-09-12T00:00:00Z,4,Audiência Pública realizada com o convidado Luciano Oliva Patricio - Representante do  Secretário de Educação Básica do Ministério da Educação.,PEC01515,1005,Arquivada,NA,2126073
2126073,camara,2018-03-01T00:00:00Z,5,Arquivado por ter sido atendido o objetivo do Requerimento.,PEC01515,502,Arquivada,NA,2126073
