prop_id,casa,data_hora,sequencia,texto_tramitacao,sigla_local,id_situacao,descricao_situacao,link_inteiro_teor,id_principal
2200650,camara,2019-05-08T15:28:00Z,1,"Apresentação do Requerimento n. 2/2019, pela Deputada Professora Rosa Neide (PT-MT), que: ""Requer a realização de Audiência Pública para discutir o Fundeb Permanente. Convidados: Jorge Abrahão de Castro - Economista; Rubens Barbosa de Camargo - Associação Nacional de Pesquisa em Financiamento da Educação (FINEDUCA); Binho Marques - Consultor em Educação e Carlos Abicalil - Professor de Educação Básica"".",PEC01515,100,Aguardando Providências Internas,http://www.camara.gov.br/proposicoesWeb/prop_mostrarintegra?codteor=1743191,2200650
2200650,camara,2019-05-14T14:30:00Z,2,Aprovado.,PEC01515,241,Aguardando Providências Internas,NA,2200650
2200650,camara,2019-05-21T00:00:00Z,3,"Audiência Pública realizada com a presença do Sr. Jorge Abrahão de Castro, Economista.",PEC01515,1005,Aguardando Providências Internas,NA,2200650
2200650,camara,2019-05-28T00:00:00Z,4,"Audiência Pública realizada com a presença do Sr. Carlos Abicalil, Professor Mestre em Educação e Gestão de Políticas Públicas",PEC01515,1005,Aguardando Providências Internas,NA,2200650
2200650,camara,2019-05-30T00:00:00Z,5,Audiência Pública realizada com o Sr. BINHO MARQUES - Ex-Secretário - SASE.,PEC01515,1005,Aguardando Providências Internas,NA,2200650
2200650,camara,2019-06-18T00:00:00Z,6,"Audiência Pública realizada com a presença do Sr. José Marcelino de Rezende Pinto, Professor e Representante da Associação Nacional de Pesquisadores em Financiamento da Educação - FINEDUCA.",PEC01515,1005,Aguardando Providências Internas,NA,2200650
