prop_id,casa,data_hora,sequencia,texto_tramitacao,sigla_local,id_situacao,descricao_situacao,link_inteiro_teor,id_principal
544203,camara,2012-05-10T00:00:00Z,2,Publicação inicial no DCD do dia 11/05/2012,SEPUB(SGM),604,NA,NA,544203
544203,camara,2012-05-10T09:39:00Z,1,"Apresentação do Requerimento n. 5236/2012, pelo Deputado Edmar Arruda (PSC-PR), que: ""Requer a inclusão na Ordem do Dia da Proposta de Emenda à Constituição no 35, de 2011, que ""altera o artigo 7º, inciso XXXIII, da Constituição Federal para permitir que o adolescente possa ser empregado a partir dos 14 anos de idade, exceto quando o trabalho for noturno e ou considerado perigoso ou insalubre"""".",PLEN,100,NA,http://www.camara.gov.br/proposicoesWeb/prop_mostrarintegra?codteor=1005190,544203
544203,camara,2012-05-10T15:41:00Z,3,Recebimento pel a SEPRO.,SEPRO,500,NA,NA,544203
544203,camara,2012-05-10T16:06:00Z,4,Encaminhado à(ao) SECOD(SGM) através da guia de Remessa (GR/SEPRO) nº 2311/2012.,SEPRO,180,NA,NA,544203
544203,camara,2012-06-22T00:00:00Z,5,Original encaminhado à CCP(DECOM).,PLEN,1005,NA,NA,544203
544203,camara,2015-01-28T00:00:00Z,6,"DECISÃO DA PRESIDÊNCIA: Com base no Art. 17, inciso II, alínea ""d"", do RICD, determino oarquivamento definitivo dos Requerimentos de Inclusão na Ordem do Dia, tendo em vista o fim da presente legislatura. Após, juntem-se aos respectivos processados. Publique-se.",MESA,502,Arquivada,http://www.camara.gov.br/proposicoesWeb/prop_mostrarintegra?codteor=1296448,544203
