prop_id,casa,data_hora,sequencia,texto_tramitacao,sigla_local,id_situacao,descricao_situacao,link_inteiro_teor,id_principal
2172754,camara,2018-04-19T14:02:00Z,1,"Apresentação do Requerimento n. 12/2018, pelo Deputado Ezequiel Teixeira (PODE-RJ), que: ""Requer a realização de Audiência Pública para debater o PL 6621/2016, com a participação de especialistas no tema e integrantes das Cortes de Contas da União, Rio de Janeiro e São Paulo"".",PL662116,100,Arquivada,http://www.camara.gov.br/proposicoesWeb/prop_mostrarintegra?codteor=1653531,2172754
2172754,camara,2018-04-25T14:30:00Z,2,Aprovado.,PL662116,241,Arquivada,NA,2172754
2172754,camara,2018-04-27T00:00:00Z,3,"Enviado ofícios aos Senhores Renato Martins Costa, José Vicente Santos de Mendonça e Mariana Montebello Willeman, com convite para Audiência Pública a ser realizada no dia 08/05/18.",PL662116,1005,Arquivada,NA,2172754
2172754,camara,2018-04-27T00:00:00Z,4,"Enviado ofício à Senhora Patrícia Sampaio, com convite para Audiência Pública a ser realizada no dia 09/05/18.",PL662116,1005,Arquivada,NA,2172754
2172754,camara,2018-05-08T00:00:00Z,5,"Audiência Pública realizada com a presença dos seguintes convidadosProcurador Regional da República LUIZ AUGUSTO SANTOS LIMA , representando o Subprocurador-Geral da República José Elaeres Marques Teixeira, Ministério Público Federal. JOÃO MANOEL PINHO DE MELLO, Secretário de Promoção da Produtividade e Advocacia da Concorrência do Ministério da Fazenda. MARCELO PACHECO DOS GUARANYS, Subchefe de Análise e Acompanhamento de Políticas Governamentais da Casa Civil; eJOSÉ VICENTE SANTOS DE MENDONÇA, Professor da Universidade do Estado do Rio de Janeiro (UERJ) e Coordenador do Laboratório de Regulação Econômica da UERJ.",PL662116,1005,Arquivada,NA,2172754
2172754,camara,2018-05-09T00:00:00Z,6,"Audiência Pública realizada com a presença dos seguintes convidados:Subprocurador-Geral da República ANTÔNIO CARLOS FONSECA DA SILVA , Presidente do Conselho de Ética do Instituto Ética Saúde (IES);JULIANA BONACORSI DE PALMA , Doutora e Mestre pela Faculdade de Direito da Universidade de São Paulo, representando Fernando Scharlack Marcato, Advogado e Professor da FGV-SP;OTÁVIO LUIZ RODRIGUES JUNIOR , Professor de Direito Civil da Faculdade de Direito da USP; ePATRÍCIA SAMPAIO , Professora da Escola de Direito da FGV-RJ.",PL662116,1005,Arquivada,NA,2172754
