prop_id,casa,tipo_materia,numero,ano,data_apresentacao,ementa,palavras_chave,autor_nome,casa_origem,apelido_materia,tema
2121442,camara,PL,6726,2016,2016-12-14T22:16:00Z,"Regulamenta o limite remuneratório de que tratam o inciso XI e os §§ 9º e 11 do art. 37 da Constituição Federal. Revoga as Leis nº 8.448, de 1992 e 8.852, de 1994 e dispositivos das Leis nº 8.112, de 1990 e 10.887, de 2004.
","Regulamentação, Constituição Federal (1988), teto salarial, administração pública, União, Estado, Distrito Federal, Município, agente público, aposentadoria, pensão, remuneração, Ministro do Supremo Tribunal Federal.
_Alteração, Regime Jurídico Único dos Servidores Públicos Civis da União, revogação, dispositivo legal, teto salarial. 
_Revogação, lei federal, regulamentação, teto salarial, servidor público. 
_Revogação, lei federal, remuneração, servidor público. 
_Alteração, lei federal, revogação, dispositivo legal, sistema integrado de dados, União, Estado, Distrito Federal, Município, remuneração, servidor público, aposentado, pensionista. 
",Senado Federal - Comissão Especial do Extrateto SF ,Senado Federal,Lei do teto remuneratório,Agenda Nacional
