prop_id,casa,data_hora,sequencia,texto_tramitacao,sigla_local,id_situacao,descricao_situacao,link_inteiro_teor,id_principal
2116317,camara,2016-11-08T16:20:00Z,1,"Apresentação do Requerimento de Audiência Pública n. 10/2016, pelo Deputado Flavinho (PSB-SP), que: ""Requer a realização de Audiência Pública destinada a debater o Projeto de Lei n º 7.180/2014. Convidados: Viviane Petinelli - doutora em ciência política pela UFMG - MG; Roberto Franklin de Leão - Presidente da Confederação Nacional dos Trabalhadores em Educação - CNTE; Roberto Geraldo de Paiva Dornas - CONFENEM; Presidente da União Nacional dos Dirigentes Municipais da Educação - UNDIME; Guilherme Schelb - Procurador da República DF"".",PL718014,100,Arquivada,http://www.camara.gov.br/proposicoesWeb/prop_mostrarintegra?codteor=1505649,2116317
2116317,camara,2016-11-30T14:30:00Z,2,Aprovado por unanimidade,PL718014,241,Arquivada,NA,2116317
2116317,camara,2017-02-21T00:00:00Z,3,Audiência Pública realizada com Gilmar Soares Ferreira - CNTE.,PL718014,1005,Arquivada,NA,2116317
2116317,camara,2017-03-21T00:00:00Z,4,Audiência Pública realizada com Guilherme Shelb - Procurador DF.,PL718014,1005,Arquivada,NA,2116317
2116317,camara,2017-03-28T00:00:00Z,5,Audiência Pública realizada com João Luiz Cesariano Rosa - Confenen.,PL718014,1005,Arquivada,NA,2116317
2116317,camara,2019-01-15T00:00:00Z,6,Arquivada,PL718014,502,Arquivada,NA,2116317
