prop_id,casa,data_hora,sequencia,texto_tramitacao,sigla_local,id_situacao,descricao_situacao,link_inteiro_teor,id_principal
2123676,camara,2017-02-15T12:33:00Z,1,"Apresentação do Requerimento de Audiência Pública n. 15/2017, pelo Deputado João Campos (PRB-GO), que: ""Requer Audiência pública para debater o Projeto de Lei nº 7.180/2014, que altera o art. 3º da Lei nº 9.394, de 20 de dezembro de 1996, para incluir entre os princípios do ensino o respeito às convicções do aluno, de seus pais ou responsáveis, dando precedência aos valores de ordem familiar sobre a educação escolar nos aspectos relacionados à educação moral, sexual e religiosa.Convidados: Flávio Bolsonaro, Marcelo Van Hattem, Gilson de Souza, Luiz Fernando Machado, Carlos Bolsonaro, Alexandre Aleluia e Sergio Fernando"".",PL718014,100,Arquivada,http://www.camara.gov.br/proposicoesWeb/prop_mostrarintegra?codteor=1525511,2123676
2123676,camara,2017-02-21T15:00:00Z,2,Aprovado.Subscrito pelos Deputados Pr. Marco Feliciano e Paulo Freire.,PL718014,241,Arquivada,NA,2123676
2123676,camara,2017-05-09T00:00:00Z,3,Audiência Pública realizada com Alexandre Aleluia - Vereador de Salvador,PL718014,1005,Arquivada,NA,2123676
2123676,camara,2017-05-30T00:00:00Z,4,"Audiência Pública realizada com Orley José - Professor , Rebeca Otero - UNESCO e Marcel Van Hattem - Deputado Estadual RS.",PL718014,1005,Arquivada,NA,2123676
2123676,camara,2017-07-11T00:00:00Z,5,Audiência Pública realizada com Gilson de Souza - Deputado Estadual do Paraná,PL718014,1005,Arquivada,NA,2123676
2123676,camara,2019-01-15T00:00:00Z,6,Arquivada,PL718014,502,Arquivada,NA,2123676
