prop_id,casa,data_hora,sequencia,texto_tramitacao,sigla_local,id_situacao,descricao_situacao,link_inteiro_teor,id_principal
2123743,camara,2017-02-15T15:53:00Z,1,"Apresentação do Requerimento n. 16/2017, pelo Deputado Eduardo Bolsonaro (PSL-SP), que: ""Requer a inclusão de debatedores para Audiência Pública da Comissão Especial destinada a proferir parecer ao Projeto de Lei nº 7180, de 2014 - Escola Sem Partido.Convidados:Douglas GarciaJosiane SilvaNanda SallesWaleska RodriguesKessia DutraSamantha BarrosStefanny PapaianoMaria Oliveira"".",PL718014,100,Arquivada,http://www.camara.gov.br/proposicoesWeb/prop_mostrarintegra?codteor=1525653,2123743
2123743,camara,2017-02-21T15:00:00Z,2,Aprovado.Subscrito pelo Deputado Pr. Marco Feliciano.,PL718014,241,Arquivada,NA,2123743
2123743,camara,2017-03-14T00:00:00Z,3,Audiência Pública realizada com Douglas Salles e Fernanda Salles - Estudantes.,PL718014,1005,Arquivada,NA,2123743
2123743,camara,2017-04-18T00:00:00Z,4,Audiência Pública realizada com Steffany Papaiano - Estudante,PL718014,1005,Arquivada,NA,2123743
2123743,camara,2019-01-15T00:00:00Z,5,Arquivada,PL718014,502,Arquivada,NA,2123743
