prop_id,casa,data_hora,sequencia,texto_tramitacao,sigla_local,id_situacao,descricao_situacao,link_inteiro_teor,id_principal
2124523,camara,2017-03-03T11:48:00Z,1,"Apresentação do Requerimento n. 19/2017, pelo Deputado Joaquim Passarinho (PSD-PA), que: ""Requer que seja submetido à deliberação do Plenário desta Comissão Especial o pedido ora formulado de convite aos Srs. Thomas Giulliano Ferreira dos Santos, Victor Sales Pinheiro e Carlos Âncede Nougué, para contribuir, em Audiência Pública, com o bom andamento desta Comissão"".",PL718014,100,Arquivada,http://www.camara.gov.br/proposicoesWeb/prop_mostrarintegra?codteor=1528104,2124523
2124523,camara,2017-03-07T15:00:00Z,2,Aprovado,PL718014,241,Arquivada,NA,2124523
2124523,camara,2017-03-21T00:00:00Z,3,Audiência Pública realizada com Thomas Giulliano - Professor de História.,PL718014,1005,Arquivada,NA,2124523
2124523,camara,2017-04-18T00:00:00Z,4,Audiência Pública realizada com Vitor Sales Pinheiro - Jurista e Filósofo.,PL718014,1005,Arquivada,NA,2124523
2124523,camara,2019-01-15T00:00:00Z,5,Arquivada,PL718014,502,Arquivada,NA,2124523
