prop_id,casa,data_hora,sequencia,texto_tramitacao,sigla_local,id_situacao,descricao_situacao,link_inteiro_teor,id_principal
2123253,camara,2017-02-09T17:06:00Z,1,"Apresentação do Requerimento de Audiência Pública n. 9/2017, pelo Deputado Davidson Magalhães (PCdoB-BA), que: ""Requer sejam convidados o Sr. Marcelo Galiza, Pesquisador do IPEA, o Sr. Alberto Ercílio Broch, Presidente da CONTAG, o Sr. Cláudio Bastos, Presidente da FETAG-Ba, o Sr. Adilson Araújo, Presidente da Central dos Trabalhadores e Trabalhadoras do Brasil - CTB, a Sra Jane Lucia Wilhelm Berwanger, Presidente do Instituto  Brasileiro de Direito Previdenciário, o Sr. Peter Poschen, Diretor da OIT-Brasil, a Sra. Selene Barboza Michielin, Secretária de Aposentados e Assuntos Previdenciários da CNTE com a finalidade de participar de Audiência Pública a realizar-se nesta Comissão Especial,  que irá proferir parecer à Proposta de Emenda à Constituição nº 287, de 2016, do Poder Executivo, que ' Altera os arts. 37, 40, 109, 149, 167, 195, 201 e 203 da Constituição, para dispor sobre a seguridade social, estabelece regras de transição e dá outras providências.'"".",PEC28716,100,Arquivada,http://www.camara.gov.br/proposicoesWeb/prop_mostrarintegra?codteor=1524279,2123253
2123253,camara,2017-02-14T14:00:00Z,2,Aprovado,PEC28716,241,Arquivada,NA,2123253
2123253,camara,2017-02-21T00:00:00Z,3,Realizada Audiência Pública em 21/02/2017.,PEC28716,1005,Arquivada,NA,2123253
2123253,camara,2017-03-22T00:00:00Z,4,Realizada Audiência Pública em 22/03/2017.,PEC28716,1005,Arquivada,NA,2123253
2123253,camara,2017-05-09T00:00:00Z,5,Arquivada,PEC28716,502,Arquivada,NA,2123253
