prop_id,casa,data_hora,sequencia,texto_tramitacao,sigla_local,id_situacao,descricao_situacao,link_inteiro_teor,id_principal
2125368,camara,2017-03-14T00:00:00Z,2,Emenda declarada insubsistente por não ter obtido o quórum mínimo de assinaturas de apoiamento.,PEC28716,1000,NA,NA,2125368
2125368,camara,2017-03-14T00:00:00Z,3,Relatório de Conferência de Assinaturas da EMC-113/2017 PEC28716 => PEC-287/2016,PEC28716,1042,NA,http://www.camara.gov.br/proposicoesWeb/prop_mostrarintegra?codteor=1533182,2125368
2125368,camara,2017-03-14T18:51:00Z,1,"Apresentação da Emenda na Comissão n. 113/2017 PEC28716, pelo Deputado Arnaldo Faria de Sá (PTB-SP).",PEC28716,100,NA,http://www.camara.gov.br/proposicoesWeb/prop_mostrarintegra?codteor=1533065,2125368
2125368,camara,2017-03-17T00:00:00Z,4,Emenda declarada insubsistente por não ter obtido o quórum mínimo de assinaturas de apoiamento.,PEC28716,1000,NA,NA,2125368
2125368,camara,2017-03-17T00:00:00Z,5,Relatório de Conferência de Assinaturas da EMC-113/2017 PEC28716 => PEC-287/2016,PEC28716,1042,NA,http://www.camara.gov.br/proposicoesWeb/prop_mostrarintegra?codteor=1535511,2125368
