prop_id,casa,data_hora,sequencia,texto_tramitacao,sigla_local,id_situacao,descricao_situacao,link_inteiro_teor,id_principal
2125286,camara,2017-03-14T00:00:00Z,4,Emenda declarada insubsistente por não ter obtido o quórum mínimo de assinaturas de apoiamento.,PEC28716,1000,NA,NA,2125286
2125286,camara,2017-03-14T00:00:00Z,5,Relatório de Conferência de Assinaturas da EMC-70/2017 PEC28716 => PEC-287/2016,PEC28716,1042,NA,http://www.camara.gov.br/proposicoesWeb/prop_mostrarintegra?codteor=1533247,2125286
2125286,camara,2017-03-14T15:49:00Z,1,"Apresentação da Emenda na Comissão n. 70/2017 PEC28716, pelo Deputado Danilo Cabral (PSB-PE).",PEC28716,100,NA,http://www.camara.gov.br/proposicoesWeb/prop_mostrarintegra?codteor=1532963,2125286
2125286,camara,2017-03-16T00:00:00Z,6,Relatório de Conferência de Assinaturas da EMC-70/2017 PEC28716 => PEC-287/2016,PEC28716,1042,NA,http://www.camara.gov.br/proposicoesWeb/prop_mostrarintegra?codteor=1533879,2125286
2125286,camara,2017-03-16T00:00:00Z,7,Relatório de Conferência de Assinaturas da EMC-70/2017 PEC28716 => PEC-287/2016,PEC28716,1042,NA,http://www.camara.gov.br/proposicoesWeb/prop_mostrarintegra?codteor=1533880,2125286
