prop_id,casa,data_hora,sequencia,texto_tramitacao,sigla_local,id_situacao,descricao_situacao,link_inteiro_teor,id_principal
470177,camara,2010-03-18T14:58:00Z,1,Apresentação do Projeto de Lei pelo Deputado Dr. Rosinha (PT-PR).,PLEN,100,Tramitando em Conjunto,http://www.camara.gov.br/proposicoesWeb/prop_mostrarintegra?codteor=745563,470177
470177,camara,2010-03-18T16:25:00Z,2,Recebimento pela SEPRO.,SEPRO,500,NA,NA,470177
470177,camara,2010-03-18T16:25:00Z,3,"Encaminhado  à SINOPSE (Revisão da Ementa, Explicação da Ementa e Indexação)",SINOPSE,1003,NA,NA,470177
470177,camara,2010-03-18T16:25:00Z,4,Encaminhado  à CEDI (Legislação Citada),CEDI,1004,NA,NA,470177
470177,camara,2010-03-18T18:33:00Z,5,Encaminhado à(ao) SECAP(SGM) através da guia de Remessa (GR/SEPRO) nº 4587/2010.,SEPRO,180,NA,NA,470177
470177,camara,2010-03-19T09:43:00Z,6,Recebimento pela SECAP(SGM).,SECAP(SGM),500,NA,NA,470177
470177,camara,2010-03-26T00:00:00Z,7,Despacho a Confirmar.,MESA,110,NA,http://www.camara.gov.br/proposicoesWeb/prop_mostrarintegra?codteor=749579,470177
470177,camara,2010-03-30T00:00:00Z,13,Apense-se (à)ao PL-4219/2008.Proposição Sujeita à Apreciação do PlenárioRegime de Tramitação: Prioridade,MESA,129,NA,http://www.camara.gov.br/proposicoesWeb/prop_mostrarintegra?codteor=749579,470177
470177,camara,2010-03-30T14:36:00Z,8,Despacho Chancelado,SECAP(SGM),180,NA,NA,470177
470177,camara,2010-03-30T14:37:00Z,9,Notificação à Sinopse de Despacho Chancelado,SECAP(SGM),1005,NA,NA,470177
470177,camara,2010-03-30T15:10:00Z,10,Retirar Chancela do Despacho.,SECAP(SGM),180,NA,NA,470177
470177,camara,2010-03-30T17:25:00Z,11,Retirar Chancela do Despacho.,SECAP(SGM),180,NA,NA,470177
470177,camara,2010-03-30T17:25:00Z,12,Despacho Chancelado,SECAP(SGM),180,NA,NA,470177
470177,camara,2010-03-30T17:26:00Z,15,Encaminhado à(ao) CCP através da guia de Remessa (GR/SECAP(SGM)) nº 1478/2010.,SECAP(SGM),180,NA,NA,470177
470177,camara,2010-03-30T17:26:00Z,14,Encaminhamento de Despacho de Distribuição à CCP para publicação.,MESA,604,NA,NA,470177
470177,camara,2010-03-31T16:39:00Z,16,Recebimento pela CCP.,CCP,500,NA,NA,470177
470177,camara,2010-04-05T00:00:00Z,17,Realizar o Encaminhamento para CCJC,CCP,910,NA,NA,470177
470177,camara,2010-04-05T19:34:00Z,18,Encaminhado à(ao) CCJC através da guia de Remessa (GR/CCP) nº 10246/2010.,CCP,180,NA,NA,470177
470177,camara,2010-04-06T00:00:00Z,19,Encaminhada à publicação. Publicação Inicial no DCD de 07 04 10 PAG 13344 COL 01.,CCP,604,NA,http://www.camara.gov.br/proposicoesWeb/prop_mostrarintegra?codteor=786423,470177
470177,camara,2010-04-06T16:12:00Z,20,Recebimento pela CCJC.,CCJC,500,NA,NA,470177
470177,camara,2010-04-06T18:12:00Z,21,Apensação desta proposição ao PL 4219/2008.,CCJC,106,NA,NA,470177
470177,camara,2011-01-31T00:00:00Z,22,Arquivado nos termos do Artigo 105 do Regimento Interno da Câmara dos Deputados. Publicação no DCD do dia 01/02/2011 - Suplemento ao nº 14.,MESA,502,NA,http://www.camara.gov.br/proposicoesWeb/prop_mostrarintegra?codteor=850547,470177
470177,camara,2011-02-08T19:45:00Z,23,"Apresentação do REQ 229/2011, pelo Dep. Dr. Rosinha, que solicita o desarquivamento de proposição.",MESA,640,NA,http://www.camara.gov.br/proposicoesWeb/prop_mostrarintegra?codteor=838229,470177
470177,camara,2011-02-15T10:10:00Z,24,"Desarquivado nos termos do Artigo 105 do RICD, em conformidade com o despacho exarado no REQ-40/2011.",MESA,640,NA,http://www.camara.gov.br/proposicoesWeb/prop_mostrarintegra?codteor=839709,470177
470177,camara,2011-02-15T10:10:00Z,25,Reentrada na comissão por motivo de desarquivamento,SECAP(SGM),630,NA,NA,470177
470177,camara,2011-02-15T10:10:00Z,26,Reentrada na comissão por motivo de desarquivamento,SECAP(SGM),630,NA,NA,470177
470177,camara,2011-02-15T10:10:00Z,27,Reentrada na comissão por motivo de desarquivamento,SECAP(SGM),630,NA,NA,470177
470177,camara,2011-02-16T15:32:00Z,28,"Devido a desarquivamento desta proposição em requerimento anterior, foi declarada prejudicada a solicitação de desarquivamento constante do REQ-229/2011.",MESA,640,NA,http://www.camara.gov.br/proposicoesWeb/prop_mostrarintegra?codteor=840291,470177
470177,camara,2014-01-08T14:31:00Z,29,"Recebimento pela CCP, apensado ao PL-4219/2008",CCP,500,NA,NA,470177
470177,camara,2014-02-10T15:14:00Z,30,"Recebimento pela CCJC, apensado ao PL-4219/2008",CCJC,500,NA,NA,470177
470177,camara,2018-04-09T11:29:00Z,31,"Recebimento pela CCP, apensado ao PL-4219/2008",CCP,500,NA,NA,470177
470177,camara,2019-06-24T00:00:00Z,32,"Despacho exarado nos Projetos de Lei n. 6.928/2002, n. 689/2003, n. 758/2003, n. 4.718/2004, n. 7.004/2006, n. 1.846/2007, n. 3.310/2012, n. 3.453/2012, n. 6.056/2013, n. 2.115/2015, n. 7.574/2017, n. 8.648/2017, n. 11.119/2018, n. 67/2019, n. 2.262/2019 e n. 2.660/2019 do bloco encabeçado pelo Projeto de Lei n. 7.005/2013, conforme o seguinte teor:    Desapensem-se os Projetos de Lei n. 6.928/2002, n. 689/2003, n. 758/2003, n. 4.718/2004, n. 7.004/2006, n. 1.846/2007, n. 3.310/2012, n. 3.453/2012, n. 6.056/2013, n. 2.115/2015, n. 7.574/2017, n. 8.648/2017, n. 11.119/2018, n. 67/2019, n. 2.262/2019 e n. 2.660/2019 do bloco encabeçado pelo Projeto de Lei n. 7.005/2013. Por conseguinte, determino a criação de um novo bloco de proposições a ser encabeçado pelo PL n. 6.928/2002, ao qual deverão ser apensados os PLs n. 689/2003 (e a este, os PLs n. 1.846/2007 e n. 3.453/2012), n. 758/2003, n. 4.718/2004 (e a este, os PLs n. 2.115/2015 e n. 8.648/2017), n. 7.004/2006, n. 3.310/2012, n. 6.056/2013, n. 7.574/2017 (e a este, o PL n. 2.262/2019) e n. 11.119/2018 (e a este, os PLs n. 2.660/2019 e n. 67/2019).Distribua-se o bloco à Comissão de Constituição e Justiça e de Cidadania (mérito e art. 54 do RICD), para que seja apreciado pelo Plenário, em regime de urgência (art. 155 do RICD). Ao PL n. 7005/2013, apensem-se os PLs n. 4.219/2008 (e a este, o PL n. 7.003/2010), n. 4.764/2009 (e a este, o PL n. 5.121/2013), n. 4.805/2009, n. 6.827/2013 e n. 7.682/2014. Publique-se. [ATUALIZAÇÃO DO DESPACHO DO PROJETO DE LEI N. 6.928/2002: à CCJC (mérito e art. 54 do RICD). Proposição sujeita à apreciação do Plenário. . Regime de Tramitação: Urgência (art. 155 do RICD)].)",MESA,203,NA,NA,470177
