prop_id,casa,data_hora,sequencia,texto_tramitacao,sigla_local,id_situacao,descricao_situacao,link_inteiro_teor,id_principal
2169611,camara,2018-03-20T14:39:00Z,1,"Apresentação do Requerimento de Audiência Pública n. 22/2018, pelo Deputado Eduardo Cury (PSDB-SP), que: ""Requer a realização de Audiência Pública na Comissão Especial para debater o PL nº 1.292/1995, do Senado Federal, e apensados, sendo convidados Vitor Rhein Schirato, Professor Doutor de Direito Administrativo da Faculdade de Direito da Universidade de São Paulo (USP); Rodrigo Pagani de Souza, Professor Doutor de Direito Administrativo da Faculdade de Direito da Universidade de São Paulo (USP) e da Fundação Getúlio Vargas de São Paulo; André Marques Gilberto, advogado especialista em direito administrativo e concorrencial, e mestre em Direito Administrativo da Faculdade de Direito da Universidade de São Paulo (USP); e José Raimundo Braga Coelho, Presidente da Agência Espacial Brasileira (AEB)"".",PL129295,100,Arquivada,http://www.camara.gov.br/proposicoesWeb/prop_mostrarintegra?codteor=1645768,2169611
2169611,camara,2018-03-27T00:00:00Z,2,Aprovado.,PL129295,241,Arquivada,NA,2169611
2169611,camara,2018-04-24T00:00:00Z,3,"Audiência Pública realizada em 24/04/18 com o convidado José Raimundo Braga Coelho, Presidente da Agência Espacial Brasileira - AEB.",PL129295,1005,Arquivada,NA,2169611
2169611,camara,2018-04-25T00:00:00Z,4,"Audiência Pública realizada em 24/04/18 com o convidado Rodrigo Pagani de Souza, Professor Doutor de Direito Administrativo da Faculdade de Direito da USP e da FGV/SP.",PL129295,1005,Arquivada,NA,2169611
2169611,camara,2019-01-31T00:00:00Z,5,"Arquivado em decorrência da extinção da Comissão, nos termos do Art. 22, II, RICD.",PL129295,502,Arquivada,NA,2169611
