prop_id,casa,data_hora,sequencia,texto_tramitacao,sigla_local,id_situacao,descricao_situacao,link_inteiro_teor,id_principal
2209950,camara,2019-06-28T16:21:00Z,1,"Apresentação do Requerimento n. 1862/2019, pelo Deputado Major Vitor Hugo (PSL/GO), que ""Requer a desapensação do PL nº 1.597, de 2019, apensado ao PL nº 2.393, de 2015. "".",PLEN,100,NA,http://www.camara.gov.br/proposicoesWeb/prop_mostrarintegra?codteor=1771577,2209950
2209950,camara,2019-06-28T16:21:00Z,2,Realizar o Encaminhamento para NAJUR(SGM),SEPRO,910,NA,NA,2209950
2209950,camara,2019-06-28T18:24:00Z,3,Encaminhado à(ao) NAJUR(SGM) através da guia de Remessa (GR/SEPRO) nº 918/2019.,SEPRO,180,NA,NA,2209950
2209950,camara,2019-07-01T00:00:00Z,5,Realizar o Encaminhamento para SECAP(SGM),NAJUR(SGM),910,Aguardando Despacho do Presidente da Câmara dos Deputados,NA,2209950
2209950,camara,2019-07-01T13:38:00Z,4,Recebimento pelo NAJUR(SGM).,NAJUR(SGM),500,Aguardando Despacho do Presidente da Câmara dos Deputados,NA,2209950
2209950,camara,2019-07-01T14:09:00Z,6,Encaminhado à(ao) SECAP(SGM) através da guia de Remessa (GR/NAJUR(SGM)) nº 136/2019.,NAJUR(SGM),180,Aguardando Despacho do Presidente da Câmara dos Deputados,NA,2209950
2209950,camara,2019-07-01T15:33:00Z,7,Recebimento pela SECAP(SGM).,SECAP(SGM),500,NA,NA,2209950
2209950,camara,2019-07-10T13:30:00Z,8,Encaminhado à(ao) NAJUR(SGM) através da guia de Remessa (GR/SECAP(SGM)) nº 281/2019.,SECAP(SGM),180,NA,NA,2209950
2209950,camara,2019-07-10T14:09:00Z,9,Recebimento pelo NAJUR(SGM).,NAJUR(SGM),500,Aguardando Despacho do Presidente da Câmara dos Deputados,NA,2209950
