prop_id,casa,data_hora,sequencia,texto_tramitacao,sigla_local,id_situacao,descricao_situacao,link_inteiro_teor,id_principal
2018336,camara,2015-10-16T16:45:00Z,1,"Apresentação do Requerimento n. 87/2015, pelo Deputado Átila Lira (PSB-PI), que: ""Requer a realização de Audiência Pública para debater sobre a conservação e o uso sustentável dos ecossistemas costeiros e marinhos"".",CMADS,100,Arquivada,http://www.camara.gov.br/proposicoesWeb/prop_mostrarintegra?codteor=1401146,2018336
2018336,camara,2015-10-21T10:00:00Z,2,Aprovado por unanimidade.,CMADS,241,Arquivada,NA,2018336
2018336,camara,2015-11-03T00:00:00Z,3,"1º evento realizado com a participação dos seguintes expositores:- Capitão-de-Mar-e-Guerra CARLOS ROBERTO LEITE, Encarregado da Divisão de Recursos Não-Vivos da Secirm - Secretaria da Comissão Interministerial para os Recursos do Mar da Marinha do Brasil- UGO VERCILLO, Secretário de Biodiversidade e Florestas Substituto do MMA - Ministério do Meio Ambiente- UIRÁ OLIVEIRA, Coordenador-Geral de Gestão Ambiental, Saúde e Segurança da Secretaria de Portos da Presidência da República- LEANDRA GONÇALVES, Coordenadora do Programa Costa Atlântica da SOS Mata Atlântica",CMADS,1005,Arquivada,NA,2018336
2018336,camara,2015-11-24T00:00:00Z,4,"2º evento realizado com a participação dos seguintes expositores:- Comandante FLÁVIO LEME, Presidente da Comissão Nacional da Pesca da CNA - Confederação da Agricultura e Pecuária do Brasil- MARCO AURÉLIO BAILON, Oceanógrafo e Coordenador Técnico, representante do Sindipi - Sindicato dos Armadores e das Indústrias da Pesca de Itajaí e Região",CMADS,1005,Arquivada,NA,2018336
2018336,camara,2015-11-24T00:00:00Z,5,Arquivada,CMADS,502,Arquivada,NA,2018336
