prop_id,casa,data_hora,sequencia,texto_tramitacao,sigla_local,id_situacao,descricao_situacao,link_inteiro_teor,id_principal
1692944,camara,2015-08-26T00:00:00Z,2,"Apresentação do Requerimento n. 67/2015, pelo Deputado João Fernando Coutinho (PSB-PE), que: ""Requer a inclusão do Requerimento nº 66/2015 na Ordem do Dia  da Comissão"".",CME,194,Arquivada,NA,1692944
1692944,camara,2015-08-26T00:00:00Z,4,"Aprovado por unanimidade o Requerimento, tendo sido subscrito pelo Deputado Rodrigo de Castro. Acatada a sugestão do Deputado Beto Rosado de se incluir na lista de convidados representante da Abradee.",CME,241,Arquivada,NA,1692944
1692944,camara,2015-08-26T00:00:00Z,3,Aprovado requerimento do Sr. João Fernando Coutinho que requer a inclusão do Requerimento 66/2015 CME na Ordem do Dia  da Comissão.,CME,195,Arquivada,NA,1692944
1692944,camara,2015-08-26T09:18:00Z,1,"Apresentação do Requerimento n. 66/2015, pelo Deputado João Fernando Coutinho (PSB-PE), que: ""Requer a realização de Seminário: Portabilidade na Conta de Energia, em conjunto com a Comissão de Defesa do Consumidor, para ouvir e debater com especialistas e autoridades, políticas públicas sobre o tema, a fim de instruir o relatório do PL 1917/2015"".",CME,100,Arquivada,http://www.camara.gov.br/proposicoesWeb/prop_mostrarintegra?codteor=1376863,1692944
1692944,camara,2015-09-02T00:00:00Z,5,Seminário realizado.,CME,1005,Arquivada,NA,1692944
1692944,camara,2015-09-02T00:00:00Z,6,Arquivada,CME,502,Arquivada,NA,1692944
