prop_id,casa,data_hora,sequencia,texto_tramitacao,sigla_local,id_situacao,descricao_situacao,link_inteiro_teor,id_principal
2091780,camara,2016-07-13T16:56:00Z,1,"Apresentação do Requerimento de Audiência Pública n. 9/2016, pelo Deputado Fábio Sousa (PSDB-GO), que: ""Requer seja submetido à deliberação do Plenário desta Comissão Especial o pedido ora formulado de CONVITE aos senhores Deltan Dellagnol e Sérgio Moro, para contribuírem, em Audiência Pública, com o bom andamento desta Comissão."".",PL485016,100,Arquivada,http://www.camara.gov.br/proposicoesWeb/prop_mostrarintegra?codteor=1476957,2091780
2091780,camara,2016-08-02T00:00:00Z,2,Aprovado,PL485016,241,Arquivada,NA,2091780
2091780,camara,2016-08-04T00:00:00Z,3,Realizada Audiência Pública com o Juiz Federal Sérgio Moro.,PL485016,1005,Arquivada,NA,2091780
2091780,camara,2016-08-09T00:00:00Z,4,Realizada Audiência Pública com o Procurador da República Deltan Martinazzo Dallagnol.,PL485016,1005,Arquivada,NA,2091780
2091780,camara,2016-08-26T00:00:00Z,5,Arquivado.,PL485016,502,Arquivada,NA,2091780
