prop_id,casa,data_hora,sequencia,texto_tramitacao,sigla_local,id_situacao,descricao_situacao,link_inteiro_teor,id_principal
2092379,camara,2016-07-27T10:12:00Z,1,"Apresentação do Requerimento de Audiência Pública n. 21/2016, pelo Deputado Rubens Bueno (PPS-PR), que: ""Requer que seja realizada audiência pública para debater aspectos relacionados ao PL 4850/2016, que dispõe sobre as 10 medidas de combate à corrupção, tendo como convidados Deltan Martinazzo Dallagnol, Representante do Ministério Público Federal; e Carlos Fernando dos Santos Lima, procurador do Ministério Público Federal"".",PL485016,100,Arquivada,http://www.camara.gov.br/proposicoesWeb/prop_mostrarintegra?codteor=1478816,2092379
2092379,camara,2016-08-02T00:00:00Z,2,"Aprovado, com alteração.ALTERAÇÃO: Incluídos como convidados o Representante da Polícia Rodoviária Federal, Sr. João Carlos Lanzi, e o Presidente da Federação Nacional dos Policiais Rodoviários Federais, Sr. Pedro Cavalcanti, por sugestão do autor.",PL485016,241,Arquivada,NA,2092379
2092379,camara,2016-08-09T00:00:00Z,3,Realizada Audiência Pública com o Procurador da República Deltan Martinazzo Dallagnol.,PL485016,1005,Arquivada,NA,2092379
2092379,camara,2016-08-16T00:00:00Z,4,"Realizada Audiência Pública com os Srs. João Carlos Lanzi Alcalde, Corregedor-Geral da Polícia Rodoviária Federal, e Jesus Castro Caamano, Presidente da Federação Nacional dos Policiais Rodoviários Federais  (representando o Sr. Pedro Cavalcanti).",PL485016,1005,Arquivada,NA,2092379
2092379,camara,2019-01-31T00:00:00Z,5,"Arquivado em decorrência da extinção da Comissão (Art. 22, II, RICD).",PL485016,502,Arquivada,NA,2092379
