prop_id,casa,data_hora,sequencia,texto_tramitacao,sigla_local,id_situacao,descricao_situacao,link_inteiro_teor,id_principal
2177142,camara,2018-05-30T11:11:00Z,1,"Apresentação do Requerimento de Audiência Pública n. 5/2018, pelo Deputado Alessandro Molon (PSB-RJ), que: ""Requer a realização de Audiência Pública para debater a o PL 6670 de 2016, que institui a Política Nacional de Redução de Agrotóxicos - PnaRA"".",PL667016,100,Arquivada,http://www.camara.gov.br/proposicoesWeb/prop_mostrarintegra?codteor=1664365,2177142
2177142,camara,2018-06-05T14:30:00Z,2,Aprovado,PL667016,241,Arquivada,NA,2177142
2177142,camara,2018-06-14T00:00:00Z,3,"Encaminhado ofício  Pres. nº 07/18 de 05/06/18. Convidando para Audiência Pública no dia 19/06/18  Ubirani Otero, representando o  Instituto Nacional do Câncer - INCA.",PL667016,1005,Arquivada,NA,2177142
2177142,camara,2018-06-16T00:00:00Z,4,Encaminhada comunicação informando que a Audiência Pública marcada para o dia 19/06/18 foi adiada para o dia 26/06/18.,PL667016,1005,Arquivada,NA,2177142
2177142,camara,2018-06-26T00:00:00Z,5,"Audiência Pública realizada com a participação das seguintes convidadas JACIMARA GUERRA MACHADO  Diretora de Qualidade Ambiental, representando Suely Araújo, Presidente do Instituto Brasileiro do Meio Ambiente e dos Recursos Naturais - IBAMA e MÁRCIA SARPA Representante do Instituto Nacional do Câncer - INCA.",PL667016,1005,Arquivada,NA,2177142
2177142,camara,2019-01-31T00:00:00Z,6,Arquivado em decorrência do encerramento da Comissão Especial pelo fim da legislatura.,PL667016,502,Arquivada,NA,2177142
