prop_id,casa,data_hora,sequencia,texto_tramitacao,sigla_local,id_situacao,descricao_situacao,link_inteiro_teor,id_principal
2177264,camara,2018-05-30T16:32:00Z,1,"Apresentação do Requerimento de Audiência Pública n. 9/2018, pelo Deputado Alessandro Molon (PSB-RJ), que: ""Requer a realização de Audiência Pública para debater a o PL 6670 de 2016, que institui a Política Nacional de Redução de Agrotóxicos - PnaRA"".",PL667016,100,Arquivada,http://www.camara.gov.br/proposicoesWeb/prop_mostrarintegra?codteor=1664621,2177264
2177264,camara,2018-06-05T14:30:00Z,2,"Aprovado, com aditamento do Deputado Edmilson Rodrigues incluindo a entidade Unicafes.",PL667016,241,Arquivada,NA,2177264
2177264,camara,2018-07-11T00:00:00Z,3,Audiência Pública com a presença da seguinte convidada GENEROSA SILVA Representante da União Nacional das Cooperativas da Agricultura Familiar e Economia Solidária - Unicafes,PL667016,1005,Arquivada,NA,2177264
2177264,camara,2018-08-07T00:00:00Z,4,"Audiência Pública realizada com a presença dos seguinte convidado FERNANDO CESAR ALONSO DE OLIVEIRA, Representante da Empresa Native.",PL667016,1005,Arquivada,NA,2177264
2177264,camara,2019-01-31T00:00:00Z,5,Arquivado em decorrência do encerramento da Comissão Especial pelo fim da legislatura.,PL667016,502,Arquivada,NA,2177264
