prop_id,casa,data_hora,sequencia,texto_tramitacao,sigla_local,id_situacao,descricao_situacao,link_inteiro_teor,id_principal
2179830,camara,2018-06-20T17:15:00Z,1,"Apresentação do Requerimento n. 29/2018, pela Deputada Tereza Cristina (DEM-MS), que: ""Requer a inclusão dos representantes das entidades que especifica na Audiência Pública a ser realizada para debater 'o controle e a fiscalização do uso de Agrotóxicos no Brasil e os impactos desses produtos na saúde e meio ambiente', solicitada por meio do Requerimento nº 06 de 2018"".",PL667016,100,Arquivada,http://www.camara.gov.br/proposicoesWeb/prop_mostrarintegra?codteor=1671068,2179830
2179830,camara,2018-06-26T14:30:00Z,2,Não Deliberado,PL667016,1008,Arquivada,NA,2179830
2179830,camara,2018-07-03T14:30:00Z,3,Não Deliberado,PL667016,1008,Arquivada,NA,2179830
2179830,camara,2018-07-11T14:30:00Z,4,Aprovado com a subscrição do Dep. Nilto Tatto.,PL667016,241,Arquivada,NA,2179830
2179830,camara,2018-08-07T00:00:00Z,5,"Audiência Pública realizada com a presença do seguinte convidado MARCELO AUGUSTO BOECHAT MORANDI, Chefe-Geral da Embrapa Meio Ambiente",PL667016,1005,Arquivada,NA,2179830
2179830,camara,2018-08-13T00:00:00Z,6,"Audiência Pública com os seguintes convidados: EDIVALDO VELINI, Professor da UNESP Botucatu.",PL667016,1005,Arquivada,NA,2179830
2179830,camara,2019-01-31T00:00:00Z,7,Arquivado em decorrência do encerramento da Comissão Especial pelo fim da legislatura.,PL667016,502,Arquivada,NA,2179830
